"#","Registration No / Notification No","Product Name","Holder"
"1104","MAL19086040T","Yi Shi Yuan Dan Zhi Xiao Yao Fine Powder","Yi Si Yuan Trading Sdn. Bhd."
"1105","MAL19056086T","Shu Di Huang 0.44g/1.0g Extract Powders ""Sun Ten""","SUN TEN PHARMACEUTICAL MFG (M) SDN. BHD."
"1106","MAL18116117NC","JANIPRO BBG POWDER","Dong Foong Manufacturing Sdn Bhd"
"1107","MAL19016104HAC","Tylosina 66.8% w/w Water Soluble Powder","F.E. VENTURE SDN. BHD."
"1108","MAL19046101TC","UBB POWDER 10.6GM","TNT AGROTECH SDN BHD"
"1109","MAL19056157T","UNIFLEX MAODAN COLD AND FEVER RELIEF POWDER","S.H. UNIFLEX CHINESE MEDICAL FACTORY SDN BHD"
"1110","MAL20046092AZ","Neuronox � Powder for Solution for Injection 50 units","Orient Europharma (M) Sdn Bhd"
"1111","MAL19096094TC","Truelifesciences CEREZA-TC POWDER","WELLESTA TRUELIFE SDN. BHD."
"1112","MAL18126032N","Amazone Health Cultivin Powder","OMEGA HEALTH PRODUCTS SDN BHD"
"1113","MAL19076072TC","MAXWELL FEMINGRA POWDER","Max Well Health Sdn Bhd"
"1114","MAL19056083TC","GMAN POWDER 10.55GM","TNT AGROTECH SDN BHD"
"1115","MAL19046026NC","inutrition PROLACTOR GX powder","BESMED SDN. BHD."
"1116","MAL20046093AZ","Neuronox � Powder for Solution for Injection 100 units","Orient Europharma (M) Sdn Bhd"
"1117","MAL19036084T","HT CARE WHEATGRASS 6G POWDER","THE ORIGIN FOODS SDN. BHD."
"1118","MAL19056013HA","Lispec-44 Premix Powder","Nam Pharma Sdn. Bhd."
"1119","MAL20046094AZ","Neuronox � Powder for Solution for Injection 200 units","Orient Europharma (M) Sdn Bhd"
"1120","MAL19046140NCR","BiO-LiFE A.B. IMUNIX  Powder","BIO-LIFE MARKETING SDN. BHD."
"1121","MAL18106065NC","JANIPRO Vjoin Powder","Dong Foong Manufacturing Sdn Bhd"
"1122","MAL19016049T","Beau Queen Powder","Rising Sun Enrich Sdn Bhd"
"1123","MAL19036083TC","HOPEMATIC WHEATGRASS 3G POWDER","Hopematic Sdn Bhd"
"1124","MAL19106090TC","TNT AGROTECH LIGNOSUS RHINOCERUS 2GM POWDER","TNT AGROTECH SDN BHD"
"1125","MAL19056151NC","Redoxon Boost & Go Powder (Orange and Strawberry Flavour)","BAYER CO. (MALAYSIA) SDN. BHD."
"1126","MAL19036001HAC","Metadoxy 50% w/w Soluble Powder","Nutri Pharmax Sdn Bhd"
"1127","MAL19036020HA","NEOTM SOLUBLE POWDER","Shennong Animal Health (Malaysia) Sdn. Bhd."
"1128","MAL20076035AZ","STRIPOLE-Pantoprazole Powder for Solution for Injection 40mg","AVERROES PHARMACEUTICALS SDN. BHD."
"1129","MAL20026069ACRZ","CYMEVENE 500MG powder for concentrate for solution for infusion","DKSH MALAYSIA SDN. BHD."
"1130","MAL19076007HAC","COCCI 25%W/W PREMIX POWDER","Lim Seng Pharmachem Sdn Bhd"
"1131","MAL19036019HA","SN-FLORFENICOL 5%w/w ORAL POWDER","Shennong Animal Health (Malaysia) Sdn. Bhd."
"1132","MAL19056015HA","WONDERCEF 50mg/ml Sterile Powder for Injection","F.E. VENTURE SDN. BHD."
"1133","MAL18116124NC","JANIPRO JUST-C Vitamin C + Zinc with Acerola Powder","Janipro (M) Sdn Bhd"
"1134","MAL20066005AZ","TOPRAZ (PANTOPRAZOLE 40MG POWDER FOR SOLUTION FOR INJECTION)","SYNERRV SDN BHD"
"1135","MAL20026053AZ","Nuwiq 250IU Powder for Solution for Injection","Pharmaniaga Marketing Sdn Bhd"
"1136","MAL20026054AZ","Nuwiq 500IU Powder for Solution for Injection","Pharmaniaga Marketing Sdn Bhd"
"1137","MAL21106046ACZ","PAXUS PM (Paclitaxel) Powder for Injection 100mg","KALBE MALAYSIA SDN BHD"
"1138","MAL19076069T","DXN Black Cumin Plus Powder","DXN PHARMACEUTICAL SDN. BHD."
"1139","MAL19116051T","'S.T.T.' XI JIAO JIE DU POWDER (QU XI JIAO)","Yo Ho Lifestyle Sdn Bhd"
"1140","MAL19116097T","Yi Yi Ren Powders ""Sun Ten""","SUN TEN PHARMACEUTICAL MFG (M) SDN. BHD."
"1141","MAL19086053TC","FSH STOMACHACHE COMPOUND POWDER","FU SHENG HANG SDN BHD"
"1142","MAL19106044TC","FSH HUA TAN DAN POWDER","FU SHENG HANG SDN BHD"
"1143","MAL18126085N","Excel Herbal Soy Extract Plus Powder","Cell Well International Sdn. Bhd."
"1144","MAL20076032AZ","GYNOGEN HP 75 IU Powder and Solvent for Solution for Injection (Menotrophin for Injection BP, 75 IU/ Vial)","Haczen Sdn Bhd"
"1145","MAL19076090T","Xuan Shen Extract Powders ""Sun Ten""","SUN TEN PHARMACEUTICAL MFG (M) SDN. BHD."
"1146","MAL19076077TC","Sagittarius Life Science Soyzon Powder","Shenlu Biotech Sdn Bhd"
"1147","MAL20076049ASZ","MEDAXONUM 1G POWDER FOR SOLUTION FOR INJECTION/INFUSION","KOMEDIC SDN BHD"
"1148","MAL20076033AZ","GYNOGEN HP 150 IU Powder and Solvent for Solution for Injection (Menotrophin for injection BP, 150 IU/vial)","Haczen Sdn Bhd"
"1149","MAL20026055AZ","Nuwiq 1000IU Powder for Solution for Injection","Pharmaniaga Marketing Sdn Bhd"
"1150","MAL20026056AZ","Nuwiq 2000IU Powder for Solution for Injection","Pharmaniaga Marketing Sdn Bhd"
"1151","MAL19106025NC","itsColl Wellness Collagen Hydrolysate, Vitamin C & L- glutathione Plus Powder","ITSCOLL PRODUCTS (M) SDN.BHD."
"1152","MAL19016089N","Excel Herbal GOS & FOS Plus Powder","EXCEL HERBAL INDUSTRIES SDN. BHD."
"1153","MAL19016018N","EXCELAB Enzyme Complex Powder (Apple Flavour)","EXCEL HERBAL INDUSTRIES SDN. BHD."
"1154","MAL20046087ARZ","AFSTYLA 250IU powder and solvent for solution for injection","DKSH MALAYSIA SDN. BHD."
"1155","MAL19126079T","Nuvastatic Effervescing Powder","NATURECEUTICALS SDN BHD"
"1156","MAL21036036AZ","OMEPRO (Omeprazole Sodium Powder for Solution for Injection 40mg/vial)","CAMBER LABORATORIES SDN. BHD."
"1157","MAL20046088ARZ","AFSTYLA 500IU powder and solvent for solution for injection","DKSH MALAYSIA SDN. BHD."
"1158","MAL20046089ARZ","AFSTYLA 1000IU powder and solvent for solution for injection","DKSH MALAYSIA SDN. BHD."
"1159","MAL20046090ARZ","AFSTYLA 2000IU powder and solvent for solution for injection","DKSH MALAYSIA SDN. BHD."
"1160","MAL20046091ARZ","AFSTYLA 3000IU powder and solvent for solution for injection.","DKSH MALAYSIA SDN. BHD."
"1161","MAL19046015X","ACEVIZ (Acetylcysteine Powder for Oral Solution 600 mg)","HEALOL PHARMACEUTICALS SDN. BHD."
"1162","MAL19036041N","Excel Herbal PregnaLac Powder","EXCEL HERBAL INDUSTRIES SDN. BHD."
"1163","MAL19096082T","Yung kien B Ganoderma Powder","SHUANG HOR ENTERPRISE (M) SDN. BHD."
"1164","MAL19096010HAC","AMOSYN 500 mg/g Water Soluble Powder","Ritma Prestasi Sdn Bhd"
"1165","MAL19086014HA","MOXY 10% w/w SOLUBLE POWDER","Rural Chemical Industries Sdn Bhd"
"1166","MAL19086101T","Suo Sha Ren Extract Powders ""Sun Ten""","SUN TEN PHARMACEUTICAL MFG (M) SDN. BHD."
"1167","MAL19106064T","Yan Hu Suo 0.67g/1g Extract Powders ""Sun Ten""","SUN TEN PHARMACEUTICAL MFG (M) SDN. BHD."
"1168","MAL19096065NCZ","ATOMY VITAMIN C 550mg POWDER","ATOMY MALAYSIA SDN. BHD."
"1169","MAL19036035N","ASH II ELIGNA Powder","OMEGA HEALTH PRODUCTS SDN BHD"
"1170","MAL19106052T","Gan Cao Powder ""Sun Ten""","SUN TEN PHARMACEUTICAL MFG (M) SDN. BHD."
"1171","MAL19116096T","Huang Qin Powders ""Sun Ten""","SUN TEN PHARMACEUTICAL MFG (M) SDN. BHD."
"1172","MAL19076004HA","AMODEX 50% W/W WATER SOLUBLE POWDER","Dexchem Industries Sdn Bhd"
"1173","MAL19086055TC","V∞ G9 Herbal Powder","JASE HEALTHCARE SDN. BHD."
"1174","MAL19076003HX","DEXHEXINE 2% W/W WATER SOLUBLE POWDER","Dexchem Industries Sdn Bhd"
"1175","MAL19076160T","Yung Kien K Ganoderma Powder","SHUANG HOR ENTERPRISE (M) SDN. BHD."
"1176","MAL19036036N","ASH II AQUACORE Powder","OMEGA HEALTH PRODUCTS SDN BHD"
"1177","MAL19126033HA","TP-Erysin 300mg/g Water Soluble Powder","Thye Pharma Sdn. Bhd"
"1178","MAL19116060TC","Biogreen Organic Green Balance Powder","Green Image Organic Enterprise Sdn. Bhd."
"1179","MAL20056073T","Canssu-5 Effervescing Powder","NATURECEUTICALS SDN BHD"
"1180","MAL21016006AZ","Zithrolide 500mg Powder for Solution for Infusion","PHARMANIAGA LIFESCIENCE SDN. BHD."
"1181","MAL19126034HA","Vimelinspec Powder","Vemedim Sdn Bhd"
"1182","MAL19116095TC","FSH COUGH POWDER","FU SHENG HANG SDN BHD"
"1183","MAL21026014AZ","DECITAS (Decitabine 50mg/vial Powder For Concentrate For Solution For Infusion)","ACCORD HEALTHCARE SDN.BHD."
"1184","MAL21116147ACZ","Streptokinase Karma 1 500 000 IU Powder for Solution for Infusion","IDAMAN PHARMA SDN. BHD."
"1185","MAL19116019HA","Farmcare 20% w/w Chlortetracycline Hydrochloride Water Soluble Powder","Peterlabs Sdn Bhd"
"1186","MAL19116020HAC","VP AMOXCILN 50% W/W WATER SOLUBLE POWDER","Yeam Heng Trading Co."
"1187","MAL20106004AZ","MAPENEM (500 MG INJECTION)(POWDER FOR SOLUTION FOR INJECTION OR INFUSION)","SPG PHARMA (MALAYSIA) SDN BHD"
"1188","MAL19096003HA","QIANG KANG SHENG Amoxicillin 30%w/w Soluble Powder","Shennong Animal Health (Malaysia) Sdn. Bhd."
"1189","MAL20016177HA","TP-KSM 125/625 mg/g Water Soluble Powder","Thye Pharma Sdn. Bhd"
"1190","MAL20016241TC","Tai Yi Yuan Watermelon Plus Spray Powder","HEALTH WINNER ENTERPRISE SDN. BHD."
"1191","MAL21076002ACRZ","Cresemba powder for concentrate for solution for infusion 200mg","PFIZER (MALAYSIA) SDN. BHD."
"1192","MAL19126128T","Yu Xing Cao 0.66g/1.0g Extract Powders ""Sun Ten""","SUN TEN PHARMACEUTICAL MFG (M) SDN. BHD."
"1193","MAL19066009N","Excel Herbal Multizymes Powder (Lemon Flavour)","EXCEL HERBAL INDUSTRIES SDN. BHD."
"1194","MAL20026110NR","Shine Efiedo Probiotics Powder","Y.S.P. INDUSTRIES (M) SDN. BHD."
"1195","MAL19066007N","LANG bragman COMFORTO Powder","OMEGA HEALTH PRODUCTS SDN BHD"
"1196","MAL19086023N","OHP Probiotics & Prebiotic Powder","OMEGA HEALTH PRODUCTS SDN BHD"
"1197","MAL20046156HA","Farmadox 50% w/w Soluble Powder","F.E. VENTURE SDN. BHD."
"1198","MAL19126113TC","CELLGLO CE EYES POWDER","OLICELL GROUP (M) SDN BHD"
"1199","MAL19076032N","NHF Vitamin C Plus Powder (Passion Fruit Flavour)","EXCEL HERBAL INDUSTRIES SDN. BHD."
"1200","MAL19086026NC","Isotonix Bromelain Plus Powder","MARKET MALAYSIA SHOP SDN. BHD."
"1201","MAL19096002HA","MOXISURE 500MG/G POWDER","RANGE PHARMA SDN. BHD."
"1202","MAL20016176HA","ERYTO 30% W/W WATER SOLUBLE POWDER","Dexchem Industries Sdn Bhd"
"1203","MAL19116022HA","TP-AMPRO 200MG/G POWDER","Thye Pharma Sdn. Bhd"
"1204","MAL19096068N","Nova Asta-C Plus Oral Powder","NOVA LABORATORIES SDN. BHD."
"1205","MAL19096039NC","Isotonix Vitamin D with K2 Powder","MARKET MALAYSIA SHOP SDN. BHD."
"1206","MAL19076102N","Excel Herbal Whitabeau Powder","EXCEL HERBAL INDUSTRIES SDN. BHD."
"1207","MAL20026002NC","NUTRIBEAR Essential Fish Collagen 5g Powder","NUTRIBEAR ENTERPRISE"
"1208","MAL20026032T","PISHINE BEAUTY POWDER","PISHINE HEALTHCARE SDN. BHD."
"1209","MAL19116018HA","OXYDEX 50% W/W WATER SOLUBLE POWDER","Dexchem Industries Sdn Bhd"
"1210","MAL19116017HA","TP-CTC HCL 500 MG/G POWDER","Thye Pharma Sdn. Bhd"
"1211","MAL20106005AZ","MAPENEM (1 G INJECTION)(POWDER FOR SOLUTION FOR INJECTION OR INFUSION)","SPG PHARMA (MALAYSIA) SDN BHD"
"1212","MAL20046167HAC","LSTYVET 50%W/W PREMIX POWDER","Lim Seng Pharmachem Sdn Bhd"
"1213","MAL20016192N","Ornute Powder","YANLING NATURAL HYGIENE SDN. BHD."
"1214","MAL20026100N","BIOFERMIN� Probiotic Powder (Banana Flavour)","HOE PHARMACEUTICALS SDN. BHD."
"1215","MAL19096001HA","BUCOLYN 20MG/G POWDER","Life Biopharma Sdn. Bhd."
"1216","MAL21046010ACZ","Seacross Pemetrexed 100 mg powder for concentrate for solution for infusion","MEDISPEC (M) SDN. BHD."
"1217","MAL21046011ACZ","Seacross Pemetrexed 500 mg powder for concentrate for solution for infusion","MEDISPEC (M) SDN. BHD."
"1218","MAL20016193NC","HERBALIFE Collagen Plus Powder (Orange Flavour)","HERBALIFE PRODUCTS MALAYSIA SDN BHD"
"1219","MAL19126104NCR","eurobio® Bio-Beumax Collagen Complex Active Formula Powder","EUROBIO SDN BHD"
"1220","MAL21056010AZ","ADYNOVATE 250IU Powder and Solvent for Solution for Injection","Takeda Malaysia Sdn Bhd"
"1221","MAL21116012AZ","Bendamustine Hydrochloride Kabi 100mg Powder for Concentrate for Solution for Infusion","FRESENIUS KABI MALAYSIA SDN. BHD"
"1222","MAL21056011AZ","ADYNOVATE 500IU Powder and Solvent for Solution for Injection","Takeda Malaysia Sdn Bhd"
"1223","MAL21046012ACRZ","PERGILAS CASPOFUNGIN 50 MG POWDER FOR CONCENTRATE FOR SOLUTION FOR INFUSION","RANBAXY (MALAYSIA) SDN. BHD."
"1224","MAL21056012AZ","ADYNOVATE 750IU Powder and Solvent for Solution for Injection","Takeda Malaysia Sdn Bhd"
"1225","MAL21056013AZ","ADYNOVATE 1000IU Powder and Solvent for Solution for Injection","Takeda Malaysia Sdn Bhd"
"1226","MAL21046013ACRZ","PERGILAS CASPOFUNGIN 70mg POWDER FOR CONCENTRATE FOR SOLUTION FOR INFUSION","RANBAXY (MALAYSIA) SDN. BHD."
"1227","MAL21056014AZ","ADYNOVATE 1500IU Powder and Solvent for Solution for Injection","Takeda Malaysia Sdn Bhd"
"1228","MAL21056015AZ","ADYNOVATE 2000IU Powder and Solvent for Solution for Injection","Takeda Malaysia Sdn Bhd"
"1229","MAL21056016AZ","ADYNOVATE 3000IU Powder and Solvent for Solution for Injection","Takeda Malaysia Sdn Bhd"
"1230","MAL20126011ACZ","XELCOL (1 MIU of Colistimethate Sodium Powder for Solution For injection or infusion or inhalation)","ZULAT PHARMACY SDN. BHD."
"1231","MAL20026093NC","BiO-LiFE FleXiPro POWDER","BIO-LIFE MARKETING SDN. BHD."
"1232","MAL19126102N","NutriLife Nubiotic Powder","GN NEUTRICEUTICALS SDN. BHD."
"1233","MAL20016175HAC","ERYTHROVET 30%W/W WATER SOLUBLE POWDER","Lim Seng Pharmachem Sdn Bhd"
"1234","MAL20116015AZ","SUPRAXONE 1G (CEFTRIAXONE POWDER FOR SOLUTION FOR INJECTION/INFUSION)","PHARMEX SDN BHD"
"1235","MAL19126036HA","Deco 6% w/w Premix Powder","Weissen Company (m) Sdn. Bhd."
"1236","MAL19106076N","NHF BIOZYME Powder (Apple Flavour)","EXCEL HERBAL INDUSTRIES SDN. BHD."
"1237","MAL19096066N","NHF BIOZYME Powder (Passion Fruit Flavour)","EXCEL HERBAL INDUSTRIES SDN. BHD."
"1238","MAL19096067N","NHF BIOZYME Powder (Mixed Fruit Flavour)","EXCEL HERBAL INDUSTRIES SDN. BHD."
"1239","MAL20026109NC","Isotonix Vizion Powder","MARKET MALAYSIA SHOP SDN. BHD."
"1240","MAL21116013AZ","Bendamustine Hydrochloride Kabi 25mg Powder for Concentrate for Solution for Infusion","FRESENIUS KABI MALAYSIA SDN. BHD"
"1241","MAL20116014AZ","MIBZO Bortezomib powder for solution for Injection 3.5 mg/vial","MEGA LIFESCIENCES SDN. BHD."
"1242","MAL20046005NC","Solib Saccharomyces Boulardii 250 mg Powder","HEALOL PHARMACEUTICALS SDN. BHD."
"1243","MAL20086125T","Xin Xin Yi San Powder ""C.F.T.""","CHUAN FENG TANG PHARMACEUTICAL (M) SDN BHD"
"1244","MAL20096076T","Zhi La San Powder ""C.F.T.""","CHUAN FENG TANG PHARMACEUTICAL (M) SDN BHD"
"1245","MAL20056058TC","Nyin Oi Bao Ying Dan Powder","NYIN OI MEDICAL PRODUCT TRADING"
"1246","MAL20116153HAC","VP TYLOSIN 50% W/W WATER SOLUBLE POWDER","Yeam Heng Trading Co."
"1247","MAL20066116TC","Nyin Oi Jing Feng San Powder","NYIN OI MEDICAL PRODUCT TRADING"
"1248","MAL20076113TC","CHUAN PEI PLUS POWDER SHANGHAI BRAND","KHENG HENG MEDICAL (M) SDN BHD"
"1249","MAL20016188NC","Opceden FORTIGEN POWDER","ASIA HEALTHCARE SDN. BHD."
"1250","MAL21026020AZ","BORTEZOMIB ABG 3.5MG (BORTEZOMIB POWDER FOR SOLUTION FOR INJECTION)","ABG PHARMA SDN BHD"
"1251","MAL20026102NCR","NUHEAL 365 GCG Powder","NU HEAL 365 SDN.BHD."
"1252","MAL20036011NC","Bio+ Kidz Pre + Probiotic with Lysine and Ascorbic Acid Powder","BIOPLUS HEALTHCARE SDN BHD"
"1253","MAL19126037HA","OC 200 g/kg Premix Powder","Weissen Company (m) Sdn. Bhd."
"1254","MAL20066090TC","INSTANS Palm Extract 3.5g Powder","Nuscience Pharmaceuticals (pg) Sdn. Bhd."
"1255","MAL20066043NC","Isotonix Globeau OPC-3 Plus Powder","MARKET MALAYSIA SHOP SDN. BHD."
"1256","MAL19116079NC","JANIPRO Synbiogg Powder","Janipro (M) Sdn Bhd"
"1257","MAL19126101N","ASTAR PROBIOTICS PLUS POWDER","GN NEUTRICEUTICALS SDN. BHD."
"1258","MAL20076171TC","Hurix's Mouth Ulcer & Sore Throat Powder","JIN BIN CORPORATION SDN. BHD."
"1259","MAL20096065TC","Vitamode� Saffron 30mg Powder","Vitamode  Sdn.bhd"
"1260","MAL20076088T","Kai Kou Wang Watermelon Frost Plus Powder","SEANG WAN MANUFACTURING SDN BHD"
"1261","MAL21036008ACRZ","POLIVY 140mg Powder For Concentrate For Solution For Infusion","ROCHE (MALAYSIA) SDN. BHD."
"1262","MAL19116076N","ACELABS BeauteVita Vitamin C + E Powder","EXCEL HERBAL INDUSTRIES SDN. BHD."
"1263","MAL21056018AZ","Formoterol Neutec 12mcg Capsair Hard Capsule Inhalation Powder","MEDISPEC (M) SDN. BHD."
"1264","MAL19116077N","BioQem FORTI-J Powder","ASTRABUMI SDN.BHD."
"1265","MAL21036029ACZ","Hovid Imipenem + Cilastatin Powder for Solution for Infusion 500mg","HOVID BERHAD"
"1266","MAL21036028AZ","AIRPLUS 50/500 mcg inhalation powder","MEDISPEC (M) SDN. BHD."
"1267","MAL21036027AZ","AIRPLUS 50/250 mcg inhalation powder","MEDISPEC (M) SDN. BHD."
"1268","MAL21036026AZ","AIRPLUS 50/100 mcg inhalation powder","MEDISPEC (M) SDN. BHD."
"1269","MAL21036025ACZ","PARECOXB parecoxib (as sodium) 40mg powder for solution for injection","UNIMED SDN. BHD."
"1270","MAL20026010NC","JANIPRO SAMUCIL G Powder","Janipro (M) Sdn Bhd"
"1271","MAL21046019AZ","RELITREXED 100 (Pemetrexed 100 mg powder for concentrate for solution for infusion)","Mansa Healthcare Sdn Bhd"
"1272","MAL21046020AZ","RELITREXED 500 (Pemetrexed 500 mg powder for concentrate for solution for infusion)","Mansa Healthcare Sdn Bhd"
"1273","MAL20046162HA","DURACIN 10G/KG POWDER","RANGE PHARMA SDN. BHD."
"1274","MAL20016198NC","JANIPRO URICA Powder","Janipro (M) Sdn Bhd"
"1275","MAL20046160HA","ROBENXIN 66G/KG POWDER","RANGE PHARMA SDN. BHD."
"1276","MAL20026104NCR","eurobio® Kids Q Lysine Plus Active Formula Powder","EUROBIO SDN BHD"
"1277","MAL20046168HA","TP-OTC HCL 500MG/G WATER SOLUBLE POWDER","Thye Pharma Sdn. Bhd"
"1278","MAL21046017AZ","VAMOCIN 500mg (Vancomycin Hydrochloride Powder for Concentrate for Infusion 500mg)","AVERROES PHARMACEUTICALS SDN. BHD."
"1279","MAL20076145N","NUREOX Fiber Plus Powder","BRAND8 NUTRACEUTICAL SDN. BHD."
"1280","MAL21046018AZ","VAMOCIN 1GM (Vancomycin Hydrochloride Powder for Concentration for Infusion 1gm)","AVERROES PHARMACEUTICALS SDN. BHD."
"1281","MAL20076052XZ","ACEVIZ (Acetylcysteine Powder for Oral Solution 200 mg)","HEALOL PHARMACEUTICALS SDN. BHD."
"1282","MAL20106085TC","PANSULIN Bitter Melon Complex Powder","Omega Hill Trading Sdn Bhd"
"1283","MAL20026081XE","ACTIVZ GS 1500mg Powder","SYARIKAT WEN KEN DRUG SDN. BHD."
"1284","MAL21036016XC","DIMECTAL Powder for Oral Suspension 3g","PAHANG PHARMACY SDN. BHD."
"1285","MAL20066044N","MINERVA NZYME C PLUS POWDER","OMEGA HEALTH PRODUCTS SDN BHD"
"1286","MAL20046019N","LANG bragman LB GG Inulin + Powder","OMEGA HEALTH PRODUCTS SDN BHD"
"1287","MAL21036092T","SEVEN WHITE HERBAL POWDER","VICTORY NATURAL BEAUTY"
"1288","MAL20036015N","Excelab HANOVE Powder","EXCEL HERBAL INDUSTRIES SDN. BHD."
"1289","MAL20076064HA","VIBRASURE 500MG/G POWDER","RANGE PHARMA SDN. BHD."
"1290","MAL20096096T","Yung Kien I Ganoderma Powder","SHUANG HOR ENTERPRISE (M) SDN. BHD."
"1291","MAL20086042N","HEALOGEN POWDER","CS PROGYMS PHARMACEUTICAL SDN. BHD."
"1292","MAL21036020AZ","BORTEBIN  (Bortezomib 3.5mg Powder for Solution for Injection)","SYNERRV SDN BHD"
"1293","MAL20076158NC","NutraVita Ener- C+ Powder","Eucogen Pharma Sdn. Bhd."
"1294","MAL20066052N","AstraNu FlexLight Collagen Hydrolysate Complex Powder","ASTRABUMI SDN.BHD."
"1295","MAL20096021HAC","AMOX EXCEL 500mg/g Water Soluble Powder","F.E. VENTURE SDN. BHD."
"1296","MAL21026049T","Fu Fang Chai Hu San Powder ""C.F.T""","CHUAN FENG TANG PHARMACEUTICAL (M) SDN BHD"
"1297","MAL20076062HA","DECOFEED 60G/KG POWDER","RANGE PHARMA SDN. BHD."
"1298","MAL21066026AZ","Retrox 3.5mg Powder for Solution for Injection","INSPIRAPHARMA SDN. BHD."
"1299","MAL20086027HAC","Linco-Spectino 100 Water Soluble Powder","F.E. VENTURE SDN. BHD."
"1300","MAL21106013ACRZ","Velcade 3.5mg for Injection (sterile lyophilized powder)","JOHNSON & JOHNSON SDN. BHD."
"1301","MAL20116029HAC","LIN-SPECT 222/445 MG/G WATER SOLUBLE POWDER","Lim Seng Pharmachem Sdn Bhd"
"1302","MAL22036011ACZ","Tigelat 50mg  (Tigecycline Lyophilised Powder for Intravenous Infusion 50mg/Vial)","ZULAT PHARMACY SDN. BHD."
"1303","MAL20076156N","Excel Herbal Kids Probiotic with Lysine + Vitamin C Powder","GK BIO INTERNATIONAL SDN. BHD."
"1304","MAL20076155N","Excel Herbal Kids Probiotics with Vitamin C + Zinc Powder","GK BIO INTERNATIONAL SDN. BHD."
"1305","MAL20116067T","apotec Exone Powder","Bioalpha International Sdn. Bhd."
"1306","MAL21116016AZ","Emazole 40mg Powder for Solution for Injection/Infusion","MEDISPEC (M) SDN. BHD."
"1307","MAL20106137T","YOKASH HEALTHCARE MORINGA OLEIFERA LEAF 3G POWDER","YOKASH HEALTHCARE"
"1308","MAL20116112TC","select aloe vera 300 mg powder (Strawberry Kiwi Flavor)","MARKET MALAYSIA SHOP SDN. BHD."
"1309","MAL21086005AZ","Beriate 250 IU Powder and solvent for solution for injection or infusion","DKSH MALAYSIA SDN. BHD."
"1310","MAL21026046HA","AMOX EMV 500 mg/g Water Soluble Powder","F.E. VENTURE SDN. BHD."
"1311","MAL21086006AZ","Beriate 500 IU Powder and solvent for solution for injection or infusion","DKSH MALAYSIA SDN. BHD."
"1312","MAL21086007AZ","Beriate 1000 IU Powder and solvent for solution for injection or infusion","DKSH MALAYSIA SDN. BHD."
"1313","MAL21016026HA","OMS MECTIN 6MG/G PREMIX POWDER","Osmosis Nutrition Sdn Bhd"
"1314","MAL21096012XC","Vitamode V-Joint Powder","Vitamode  Sdn.bhd"
"1315","MAL20116113T","GMB INTERNATIONAL BIO LINGZHI 1.8G POWDER","ORIENT LABORATORIES SDN. BHD."
"1316","MAL21036124T","Nuvastatic 500 Effervescing Powder","NATURECEUTICALS SDN BHD"
"1317","MAL20106031NZ","BAAiTS VITAMIN C 1000mg POWDER","I MEDIKEL PHARMACEUTICAL SDN. BHD."
"1318","MAL21046042HA","TP-AMOCLAVU 500/125MG/G WATER SOLUBLE POWDER","Thye Pharma Sdn. Bhd"
"1319","MAL21026044HX","OMS FENBENTHIC 40MG/G PREMIX POWDER","Osmosis Nutrition Sdn Bhd"
"1320","MAL20116030HA","COSUCIN POWDER","RANGE PHARMA SDN. BHD."
"1321","MAL20116031HA","LINCOSURE 400MG/G POWDER","RANGE PHARMA SDN. BHD."
"1322","MAL21016083T","UNIFLEX FEVER, PHLEGM & COUGH RELIEF POWDER","S.H. UNIFLEX CHINESE MEDICAL FACTORY SDN BHD"
"1323","MAL21036042HA","Cencure 50mg/ml Powder For Injection","QL Pacific Vet Group Sdn. Bhd."
"1324","MAL20116032HAC","Yen-AnMo 50% W/W Powder","Yenher Agro-products Sdn. Bhd."
"1325","MAL20106047NC","GROHER POWDER","FEREENA BEAUTY & HEALTH SDN BHD"
"1326","MAL20126033HX","DOTFEED 250G/KG POWDER","RANGE PHARMA SDN. BHD."
"1327","MAL21076021X","Forlax 4g Powder for Oral Solution","ZUELLIG PHARMA SDN. BHD."
"1328","MAL20106043N","DF Prebiotics & Probiotics Powder","Dong Foong Manufacturing Sdn Bhd"
"1329","MAL20106044N","DF Probiotics Plus Powder","Dong Foong Manufacturing Sdn Bhd"
"1330","MAL21016050NC","LifeSenze Flora Biotic Powder","HL PHARMACEUTICALS SDN. BHD."
"1331","MAL21016084TC","KHENG HENG BAO YING DAN POWDER","KHENG HENG MEDICAL (M) SDN BHD"
"1332","MAL21046043HA","TRIMETOSOL 80/400 G/KG POWDER","RANGE PHARMA SDN. BHD."
"1333","MAL21016055N","PowerLIFE UC MSM Plus Powder","Esprit Care Sdn. Bhd."
"1334","MAL21026043HA","FuDuoBang 10% w/w Powder","Rural Chemical Industries Sdn Bhd"
"1335","MAL20116131N","Vsolve Cranberry + Elderberry + Inulin+ Vitamin C Powder","Dong Foong Manufacturing Sdn Bhd"
"1336","MAL21036097TC","LION BALL WATERMELON FROST COMPOUND POWDER","Gab Sdn Bhd"
"1337","MAL21046063NC","GKB Lactobacillus Rhamnosus GKG6 Plus Powder","GK BIO INTERNATIONAL SDN. BHD."
"1338","MAL20106063NC","JANIPRO BIO DVP Saccharomyces boulardii + Vitamin C with Zinc Plus Powder","Janipro (M) Sdn Bhd"
"1339","MAL21086002ARZ","Evrysdi Powder for oral solution 0.75 mg/mL","ROCHE (MALAYSIA) SDN. BHD."
"1340","MAL22076017AZ","Remifentanil Reig Jofre 5mg Powder for Concentrate for Solution for Injection or Infusion","PAHANG PHARMACY SDN. BHD."
"1341","MAL20106056N","Avenex RE-STORS Lactobacillus rhamnosus GG + Vitamin C with Zinc Plus Powder","Dong Foong Manufacturing Sdn Bhd"
"1342","MAL20106051N","V? ORT Lactobacillus reuteri + Vitamin C with Zinc Plus Powder","JASE HEALTHCARE SDN. BHD."
"1343","MAL20116140N","JH Nutrition Progutor Powder","JASE HEALTHCARE SDN. BHD."
"1344","MAL21026042HAC","Eryplus 300mg/g Water Soluble Powder","F.E. VENTURE SDN. BHD."
"1345","MAL20116142N","Ucare Cranberry + Inulin with Lactobacillus Rhamnosus & Lactobacillus Reuteri Powder","Dong Foong Manufacturing Sdn Bhd"
"1346","MAL21046116TC","Pearl Watermelon Frost Plus Powder Cap Seen Shei","Eyh Fong Trading"
"1347","MAL22076006ARZ","Oncaspar 750 U/ml powder for solution for injection/infusion","SERVIER MALAYSIA SDN. BHD."
"1348","MAL20126057NC","CRYSTAL SNOW L-GLUTATHIONE PLUS POWDER","FEREENA BEAUTY & HEALTH SDN BHD"
"1349","MAL21016047N","LANG bragman LACTOCLARIN powder","OMEGA HEALTH PRODUCTS SDN BHD"
"1350","MAL21046045HA","SULFARIM 48% W/W POWDER","Dexchem Industries Sdn Bhd"
"1351","MAL21046111T","Land Herbs Xiao Er Bao Ying Powder","WAN YEEN TRADING SDN. BHD."
"1352","MAL21026085T","REOXlife PRO Mandiva Powder","BRAND8 NUTRACEUTICAL SDN. BHD."
"1353","MAL20126034N","NUTRIDOS CALCILUV POWDER","Nutridos Marketing Sdn Bhd"
"1354","MAL21016027HA","COSAMOX, 500mg/g, Powder for use in drinking water","N.S. LABORATORY SDN. BHD."
"1355","MAL21096017HA","OMS TMS 480 PREMIX POWDER","Osmosis Nutrition Sdn Bhd"
"1356","MAL21076029HA","AMPRO EMV 300mg/g Water Soluble Powder","F.E. VENTURE SDN. BHD."
"1357","MAL21106036XCR","CONSIGEL POWDER FOR ORAL SOLUTION 3.5G","XEPA-SOUL PATTINSON (MALAYSIA) SDN. BHD."
"1358","MAL21086094T","Aromantic Powder","EXTRA EXCEL (MALAYSIA) SDN. BHD."
"1359","MAL22046021AZ","DECI SPAL-P 50 Decitabine Powder for Concentrate for Solution for Infusion, 50 mg/vial","HEALOL PHARMACEUTICALS SDN. BHD."
"1360","MAL22096012AZ","CARFILNAT (CARFILZOMIB) POWDER FOR SOLUTION FOR INFUSION 60 MG/ VIAL","DUOPHARMA (M) SENDIRIAN BERHAD"
"1361","MAL22066020AZ","Ziromin 200 mg/5 mL Powder for Oral Suspension","MEDISPEC (M) SDN. BHD."
"1362","MAL21036119T","Cran Lite Cranberry 830mg Effervescent Powder (Lemonade flavour)","WINWA MEDICAL SDN. BHD."
"1363","MAL21046086TC","YEEHO GENKI POWDER","DMI BIOTECH SDN. BHD."
"1364","MAL21106038HAC","AM-COCC 300 MG/G WATER SOLUBLE POWDER","Ritma Prestasi Sdn Bhd"
"1365","MAL22046010ARZ","Haemate P 1000IU Powder and solvent for solution for injection or infusion","DKSH MALAYSIA SDN. BHD."
"1366","MAL22046008AZ","Fibryga 1g Powder and Solvent for Solution for Injection or Infusion","Pharmaniaga Marketing Sdn Bhd"
"1367","MAL21036080N","Dale & Cecil MIWACARE PROBIOTICS+ Powder","OMEGA HEALTH PRODUCTS SDN BHD"
