"#","Registration No / Notification No","Product Name","Holder"
"1368","MAL21096015HX","Salicyline 50%w/w Powder for Oral Solution","Rhone Ma Malaysia Sdn Bhd"
"1369","MAL21056057N","FINE Hyaluronic acid & Collagen + CoQ10 Plus Powder","Cason Group Sdn. Bhd."
"1370","MAL21086036NC","Genki Lab Calcium 270mg Powder","Cason Group Sdn. Bhd."
"1371","MAL21046117T","WAI YOEN HONG GOLD BRAND WATERMELON FROST PLUS POWDER","NUTRI-HOME PHARMACEUTICAL INDUSTRIES SDN. BHD."
"1372","MAL22076023AZ","REXONIUM Calcium Polystyrene Sulfonate 99.8% Powder","KCK PHARMACEUTICAL INDUSTRIES SDN. BHD."
"1373","MAL21046050NC","Health Builders MSM 2g Powder","HEALTH BUILDERS (M) SDN. BHD."
"1374","MAL22086015AZ","TYLIN (Tigecycline Powder for Solution for Infusion 50 mg/ vial)","MEDISPEC (M) SDN. BHD."
"1375","MAL23086005X","Gaviscon Infant Powder for Oral Suspension","RB (HEALTH) MALAYSIA SDN BHD"
"1376","MAL21086056T","Ko Da Xiao Feng San Extract Powder","HENDA NATURAL SDN BHD"
"1377","MAL21056088TC","DIANZ D'HONEY GOLD PLUS POWDER","Dian Legacy Sdn Bhd"
"1378","MAL21116082T","THUR HER CHERNG CHIH TANG EXTRACT POWDER ""SHENG FOONG""","TIANYI SEM MARKETING"
"1379","MAL21106099T","XIN GAN TSAO SHIEH SHIN TANG EXTRACT POWDER ""SHENG FOONG""","TIANYI SEM MARKETING"
"1380","MAL21096063T","IN CHERN WUU LING SANN EXTRACT POWDER ""SHENG FOONG""","TIANYI SEM MARKETING"
"1381","MAL21056052N","fibreferst powder","Sky Nutraceuticals Sdn. Bhd."
"1382","MAL21096118TC","WeHealth Tiger Milk Mushroom 800mg Powder","FURLEY BIOEXTRACTS SDN. BHD."
"1383","MAL21066113T","Land Herbs Xi Gua Shuang Plus Powder","WAN YEEN TRADING SDN. BHD."
"1384","MAL21036071N","Dale & Cecil MIWACARE LYSINE+ powder","OMEGA HEALTH PRODUCTS SDN BHD"
"1385","MAL21086024HAC","NEO-MYC 500mg/g Water Soluble Powder","F.E. VENTURE SDN. BHD."
"1386","MAL21056086TC","BELLAFEMMA PEARL PLUS POWDER","FEREENA BEAUTY & HEALTH SDN BHD"
"1387","MAL21036067N","LANG bragman Probiotics with Vitamin C+ powder","OMEGA HEALTH PRODUCTS SDN BHD"
"1388","MAL21106004ACRZ","Enerzair Breezhaler (Indacaterol Acetate/Glycopyrronium Bromide/Mometasone Furoate) 150/50/160mcg Inhalation Powder Hard Capsules","NOVARTIS CORPORATION (MALAYSIA) SDN. BHD."
"1389","MAL21106002ACRZ","Atectura Breezhaler (Indacaterol Acetate/Mometasone Furoate) 150/160mcg Inhalation Powder Hard Capsules","NOVARTIS CORPORATION (MALAYSIA) SDN. BHD."
"1390","MAL21106003ACRZ","Atectura Breezhaler (Indacaterol Acetate/Mometasone Furoate) 150/320mcg Inhalation Powder Hard Capsules","NOVARTIS CORPORATION (MALAYSIA) SDN. BHD."
"1391","MAL21066063N","REOXlife Potnt Powder","BRAND8 NUTRACEUTICAL SDN. BHD."
"1392","MAL21096060N","FINE Hyaluronic Acid & Collagen Peptide Complex Powder","Cason Group Sdn. Bhd."
"1393","MAL21056039NC","Collajoint Powder","UNAM PHARMACEUTICAL (M) SDN. BHD."
"1394","MAL22126024AZ","AZADUAL 100 (Azacitidine Powder for Suspension for Injection 100mg/vial)","MEGA LIFESCIENCES SDN. BHD."
"1395","MAL22096011AZ","SKYVaricella powder and solvent for suspension for injection","PHARMANIAGA LIFESCIENCE SDN. BHD."
"1396","MAL22096004ACZ","Dolofast Sachets 50mg Powder for Oral Solution","DKSH MALAYSIA SDN. BHD."
"1397","MAL22096020AZ","ESOME Esomeprazole Sodium Powder For Solution For Injection Or Infusion (Lyophilized Powder) 40mg/Vial","UNIMED SDN. BHD."
"1398","MAL21076070T","WAI YOEN HONG GOLD BRAND CHAN KENG POWDER","NUTRI-HOME PHARMACEUTICAL INDUSTRIES SDN. BHD."
"1399","MAL23026009ARZ","Haemocomplettan P 1g Powder for solution for injection / infusion","DKSH MALAYSIA SDN. BHD."
"1400","MAL21096029NC","Tiens Zinc Plus Powder","TIENS HEALTH DEVELOPMENT (MALAYSIA) SDN. BHD."
"1401","MAL22096021AZ","MYBORTE 1.0mg (Bortezomib Powder for Solution for Injection 1.0mg/vial)","Dr. Reddy`s Laboratories Malaysia Sdn. Bhd."
"1402","MAL21046071N","Nova Berry-C Plus Oral Powder","NOVA LABORATORIES SDN. BHD."
"1403","MAL21076034HAC","Yen-AnTil 20% W/W Powder","Yenher Agro-products Sdn. Bhd."
"1404","MAL21086078T","NR Lawas Kencang Powder","MISB RESOURCES SDN. BHD."
"1405","MAL21096084T","NR Lawas Segar Powder","MISB RESOURCES SDN. BHD."
"1406","MAL21066071NC","BIOBAY YO-SHIELD Powder","GALAXIS HEALTHCARE SDN BHD"
"1407","MAL22036112T","GreenHerbs Watermelon Frost + Spray Powder","BIOFACT LIFE SDN. BHD."
"1408","MAL21076046N","PROAHC Collagen + Probiotics Powder","GN NEUTRICEUTICALS SDN. BHD."
"1409","MAL21106102TC","TLS T-Lite Powder","MARKET MALAYSIA SHOP SDN. BHD."
"1410","MAL21066068NCZ","ATOMY VITAMIN C 1000MG POWDER","ATOMY MALAYSIA SDN. BHD."
"1411","MAL22116014AZ","PEMETREX (Pemetrexed Powder for Concentrate for Solution for Infusion 500 mg)","HEALOL PHARMACEUTICALS SDN. BHD."
"1412","MAL22126213AZ","omepiva 40mg Powder and Solvent for Solution for Injection","PHARMANIAGA LIFESCIENCE SDN. BHD."
"1413","MAL24026010ACZ","QDENGA powder and solvent for solution for injection in prefilled syringe (Dengue tetravalent vaccine (live, attenuated))","Takeda Malaysia Sdn Bhd"
"1414","MAL23036003ACZ","Azacitidine Seacross 100 mg/vial powder for suspension for injection","MEDISPEC (M) SDN. BHD."
"1415","MAL22076032AZ","CEROBACT 1.2g (Amoxicillin 1000mg and Clavulanic Acid 200mg Powder for solution for infusion)","PHARMEX SDN BHD"
"1416","MAL24026009ACZ","QDENGA powder and solvent for solution for injection (Dengue tetravalent vaccine (live, attenuated))","Takeda Malaysia Sdn Bhd"
"1417","MAL22016118T","WAI YOEN HONG GOLD BRAND HOU NING POWDER","NUTRI-HOME PHARMACEUTICAL INDUSTRIES SDN. BHD."
"1418","MAL21086080TC","CSL HOU TSAO SAN POWDER","Gab Sdn Bhd"
"1419","MAL24046014AZ","RESPIDAY DISCAIR 160/4.5 MCG INHALATION POWDER","MEDISPEC (M) SDN. BHD."
"1420","MAL21076042NC","BELLAFEMMA VITAMIN C PLUS POWDER","FEREENA BEAUTY & HEALTH SDN BHD"
"1421","MAL22016137T","DXN Fomes 1g/g G Powder","DXN PHARMACEUTICAL SDN. BHD."
"1422","MAL21086104TC","Happy Link Royal Jelly 1000mg powder","HAPPY LINK DISTRIBUTORS SDN BHD"
"1423","MAL22096028AZ","Azith (Powder for Oral Suspension 200mg/5mL)","SPG PHARMA (MALAYSIA) SDN BHD"
"1424","MAL24046015AZ","RESPIDAY DISCAIR 320/9 MCG INHALATION POWDER","MEDISPEC (M) SDN. BHD."
"1425","MAL21106110TC","Tai Wah DuHuo Plus Extract Powder","UBAT CINA TAI WAH SDN BHD"
"1426","MAL21106133TC","Tai Wah Bu Zhong Extract Powder","UBAT CINA TAI WAH SDN BHD"
"1427","MAL21106132TC","Tai Wah Danzhi Plus Extract Powder","UBAT CINA TAI WAH SDN BHD"
"1428","MAL21106044HA","WeissNicarb 25% w/w Premix Powder","Weissen Company (m) Sdn. Bhd."
"1429","MAL22026092T","REOXlife PRO WMP Powder","BRAND8 NUTRACEUTICAL SDN. BHD."
"1430","MAL22026129TC","GKB Cordyceps Cicadae 350mg Powder","GK BIO INTERNATIONAL SDN. BHD."
"1431","MAL22026105TC","Wykon Xiao Er Jing Feng Powder","WYKON MEDICAL SDN. BHD."
"1432","MAL22106012AZ","DAPTOCORD-500 (Daptomycin powder for solution for infusion 500mg/vial)","ACCORD HEALTHCARE SDN.BHD."
"1433","MAL21106101TC","Tai Wah Liuwei Dihuang Extract Powder","UBAT CINA TAI WAH SDN BHD"
"1434","MAL22086022ACZ","Hovid Meropenem 1g Powder for Solution for Injection or Infusion","HOVID BERHAD"
"1435","MAL21106126TC","Tai Wah Xiangsha Ginseng Plus Extract Powder","UBAT CINA TAI WAH SDN BHD"
"1436","MAL22086023ACZ","Hovid Meropenem 500mg Powder for Solution for Injection or Infusion","HOVID BERHAD"
"1437","MAL21106039HA","L-SPEC, 222/444.7mg/g, Powder for use in drinking water","N.S. LABORATORY SDN. BHD."
"1438","MAL22126019AZ","SKYZoster powder and solvent for suspension for injection","PHARMANIAGA LIFESCIENCE SDN. BHD."
"1439","MAL21086058TC","PiSHine CLETOX POWDER","FEREENA BEAUTY & HEALTH SDN BHD"
"1440","MAL21116036HA","ZEPRALAN 1000 MG/G SOLUBLE POWDER","Life Biopharma Sdn. Bhd."
"1441","MAL21126069TC","Biofiber Powder","R&D Wellness Concept"
"1442","MAL21106158TC","Sung Khong Qing Re Bao Powder","WAN YEEN TRADING SDN. BHD."
"1443","MAL22076039AZ","Asporelix 0.25 (Cetrorelix 0.25mg Powder and Solvent for Solution for Injection)","BSV BIOSCIENCE MALAYSIA SDN. BHD."
"1444","MAL21076044N","Dale & Cecil MIWACARE ENZYMES+ Powder","OMEGA HEALTH PRODUCTS SDN BHD"
"1445","MAL22056059HA","Maducin Premix Powder 1% w/w","Y.S.P. INDUSTRIES (M) SDN. BHD."
"1446","MAL23106139AZ","Saklovir 250 mg Powder for Infusion","Hikmah Pharmaceuticals Sdn Bhd"
"1447","MAL22126014ACZ","Reblozyl 25 mg powder for solution for injection","DKSH MALAYSIA SDN. BHD."
"1448","MAL22126015ACZ","Reblozyl 75 mg powder for solution for injection","DKSH MALAYSIA SDN. BHD."
"1449","MAL21126020HA","Lincofarm TR 44% w/w Soluble Powder","F.E. VENTURE SDN. BHD."
"1450","MAL22096048HA","Eimestat 40% w/w Premix Powder","Sunzen Corporation Sdn Bhd"
"1451","MAL22096005ACRZ","ALIMTA 100 MG POWDER FOR CONCENTRATE FOR SOLUTION FOR INFUSION","ZUELLIG PHARMA SDN. BHD."
"1452","MAL22096006ACRZ","ALIMTA 500 MG POWDER FOR CONCENTRATE FOR SOLUTION FOR INFUSION","ZUELLIG PHARMA SDN. BHD."
"1453","MAL24066011ACZ","Pompezo 40mg Lyophilized Powder for Solution for Injection or Infusion","MEDISPEC (M) SDN. BHD."
"1454","MAL21106043HA","DOCLATE 50, 500mg/g, Powder for use in drinking water","N.S. LABORATORY SDN. BHD."
"1455","MAL22106010AZ","BORT SPAL 3.5 (Bortezomib Powder for Solution for Injection 3.5mg/vial)","HEALOL PHARMACEUTICALS SDN. BHD."
"1456","MAL22016032HA","TP-GENTA 300KIU/G WATER SOLUBLE POWDER","Thye Pharma Sdn. Bhd"
"1457","MAL21096027NC","MegaLive Mucokof NAC 600mg Powder","MegaLive BioSciences Sdn Bhd"
"1458","MAL21126097TC","Tai Wah Kai Wei Extract Powder","UBAT CINA TAI WAH SDN BHD"
"1459","MAL23116003AZ","Panaxib 40mg powder for solution for injection","MEDISPEC (M) SDN. BHD."
"1460","MAL22046104NC","Mary Kay® Daily Collagen+ powder","MARY KAY (MALAYSIA) SDN. BHD."
"1461","MAL23046015AZ","NIMEDINE Imipenem + Cilastatin (500+500) mg/vial Powder for Solution for Infusion","AVERROES PHARMACEUTICALS SDN. BHD."
"1462","MAL22026113T","GMB INTERNATIONAL G-TiGano Powder","ORIENT LABORATORIES SDN. BHD."
"1463","MAL23026001ACZ","Lokelma 5g Powder for Oral Suspension","ASTRAZENECA SDN. BHD."
"1464","MAL23046013AZ","GEMCIT SPAL-P 200 (Gemcitabine Powder for Solution for Infusion, USP 200 mg/vial)","HEALOL PHARMACEUTICALS SDN. BHD."
"1465","MAL23046014AZ","GEMCIT SPAL-P 1000 (Gemcitabine Powder for Solution for Infusion, USP 1000 mg/vial)","HEALOL PHARMACEUTICALS SDN. BHD."
"1466","MAL23026002ACZ","Lokelma 10g Powder for Oral Suspension","ASTRAZENECA SDN. BHD."
"1467","MAL21086040NC","BElixz GBA-BIOTICS Powder","BE INTERNATIONAL SDN BHD"
"1468","MAL21096028N","LANG bragman Vitamin C 1000mg + Probiotic Powder","OMEGA HEALTH PRODUCTS SDN BHD"
"1469","MAL21096057NC","THROZZ VITAMIN C + ZINC Effervescent Powder  (CITRUS FLAVOUR)","MEDICINSPIRE GLOBAL SDN BHD"
"1470","MAL23056014ACRZ","Voriconazole ADVAGEN powder for solution for infusion 200mg","ADVAGEN (Malaysia) Sdn Bhd"
"1471","MAL22016120TC","PISHINE BEAUTY GLOW POWDER","PISHINE HEALTHCARE SDN. BHD."
"1472","MAL22096031AZ","ONTREX 100mg Powder for Concentrate for Solution for Infusion","NOVUGEN ONCOLOGY SDN. BHD."
"1473","MAL21096044N","Excelab ImmuC Gold Forte Powder","EXCEL HERBAL INDUSTRIES SDN. BHD."
"1474","MAL21106072N","PowerLIFE UCHA8000 Powder","Esprit Care Sdn. Bhd."
"1475","MAL21126077TC","PINETOX POWDER","PISHINE HEALTHCARE SDN. BHD."
"1476","MAL21116063NC","Vitamode Kids iBiome Powder","Vitamode  Sdn.bhd"
"1477","MAL22036081TC","UROZZAL CRANBERRY 400MG EFFERVESCENT POWDER","MEDICINSPIRE GLOBAL SDN BHD"
"1478","MAL22026057NC","GK Bio ProBi10+ Powder","GK BIO INTERNATIONAL SDN. BHD."
"1479","MAL22016079NC","Trifama Vita C-500 Plus Powder","PureGlo Beauty Sdn. Bhd."
"1480","MAL21096034N","Cameron Bioscience CUR-A Powder","CAMERON BIOSCIENCE (M) SDN. BHD."
"1481","MAL21096035N","Cameron Bioscience CUR-B Powder","CAMERON BIOSCIENCE (M) SDN. BHD."
"1482","MAL21096036N","Cameron Bioscience CUR-C Powder","CAMERON BIOSCIENCE (M) SDN. BHD."
"1483","MAL23036017ACZ","ZACTRO Azithromycin Lyophilized Powder for Solution for Infusion 500mg/vial","BioCare Pharmaceutical (M) Sdn. Bhd."
"1484","MAL22046111N","SYNeRGY ENERLIFT POWDER","Synergy Worldwide Marketing Sdn  Bhd"
"1485","MAL23086029ARZ","POLIVY 30mg Powder For Concentrate For Solution For Infusion","ROCHE (MALAYSIA) SDN. BHD."
"1486","MAL22026095TC","LIONBALL SHIREE POWDER","Gab Sdn Bhd"
"1487","MAL22026066TC","LIONBALL XIN BAN XIA XIE XIN TANG POWDER","Gab Sdn Bhd"
"1488","MAL22016097TC","LIONBALL NUAN JING TANG POWDER","Gab Sdn Bhd"
"1489","MAL23036014ACZ","Ertapenem Kabi Powder for Solution for Infusion or Injection 1g/vial","FRESENIUS KABI MALAYSIA SDN. BHD"
"1490","MAL23056027AZ","Pemetrex-Venus (Pemetrexed Powder for concentrate for solution for infusion 500 mg)","HEALOL PHARMACEUTICALS SDN. BHD."
"1491","MAL22026065NC","GKB Probio8+ Powder","GK BIO INTERNATIONAL SDN. BHD."
"1492","MAL23056019ACZ","Bendamustine Hydrochloride Seacross 25mg/vial Powder For Concentrate For Solution For Infusion","MEDISPEC (M) SDN. BHD."
"1493","MAL23056020ACZ","Bendamustine Hydrochloride Seacross 100mg/vial Powder For Concentrate For Solution For Infusion","MEDISPEC (M) SDN. BHD."
"1494","MAL22026085TC","LIONBALL DU HUO DANG SHEN JI SHENG PLUS POWDER","Gab Sdn Bhd"
"1495","MAL22026081TC","LIONBALL XIN BU YANG HUAN WU TANG POWDER","Gab Sdn Bhd"
"1496","MAL23056018AZ","Qilu DECITABINE LYOPHILISED POWDER FOR INFUSION 50 MG/VIAL","MEDISPEC (M) SDN. BHD."
"1497","MAL22016093TC","Tai Wah DanZhi XiaoYao Extract Powder","UBAT CINA TAI WAH SDN BHD"
"1498","MAL22026052NC","BIOFIZZ PROBIOTIC+ Powder","Biofizz Marketing Sdn Bhd"
"1499","MAL22036131TC","BIOFORTRESS 36oC COOL Powder","ATTIVO HEALTHCARE SDN. BHD."
"1500","MAL22026079TC","Tai Wah Buzhong Yiqi Tang Extract Powder","UBAT CINA TAI WAH SDN BHD"
"1501","MAL23056013ACZ","Tigaciv 50mg Lyophilized Powder for Concentrate for Solution for Infusion","Pharmaniaga Marketing Sdn Bhd"
"1502","MAL22036100TC","Tai Wah DuHuo JiSheng Extract Powder","UBAT CINA TAI WAH SDN BHD"
"1503","MAL23076010AZ","Zithrolide Powder for Oral Suspension 200mg/5ml","INSPIRAPHARMA SDN. BHD."
"1504","MAL22036098TC","Tai Wah Xiangsha Liujun Zi Tang Extract Powder","UBAT CINA TAI WAH SDN BHD"
"1505","MAL22026043NCR","MegaLive Flora 80 Pro Powder","MegaLive BioSciences Sdn Bhd"
"1506","MAL22026042N","PREMCARE LUTEIN PLUS Powder","OMEGA HEALTH PRODUCTS SDN BHD"
"1507","MAL22046116TC","LIONBALL QING TAN ZHI KE POWDER","Gab Sdn Bhd"
"1508","MAL23026015AZ","APRITANT IV (Fosaprepitant Dimeglumine Lyophilized Powder for solution for infusion 150 mg/vial)","MEGA LIFESCIENCES SDN. BHD."
"1509","MAL22026060NC","Isotonix YeaMune Powder","MARKET MALAYSIA SHOP SDN. BHD."
"1510","MAL24086008AZ","Leudibine - Decitabine powder for concentrate for solution for infusion 50 mg/vial","UNIMED SDN. BHD."
"1511","MAL22016050NC","BRAINOS POWDER","Special Enhancement Sdn Bhd"
"1512","MAL22046069TC","Tai Wah Gui Pi Tang Extract Powder","UBAT CINA TAI WAH SDN BHD"
"1513","MAL22076059NC","PHARMATEEN CoQ10 GRAPESEED EXTRACT PLUS POWDER","I MEDIKEL PHARMACEUTICAL (M) SDN BHD"
"1514","MAL25016009AZ","BEMUNAT 100 (Bendamustine Hydrochloride 100 mg Powder for Concentrate for Solution for Infusion)","PERNIAGAAN NORMAHAS SDN. BHD."
"1515","MAL23076016AZ","Pemetrex- Venus (Pemetrexed Powder for concentrate for solution for infusion100mg)","ZULAT PHARMACY SDN. BHD."
"1516","MAL23116008AZ","ESOZ IV (Esomeprazole 40mg Powder for Solution for Injection or Infusion -Lyophilised Powder)","RANBAXY (MALAYSIA) SDN. BHD."
"1517","MAL23026089NC","Recogen Gold Collagen+ Powder","Roots Basic Sdn. Bhd."
"1518","MAL22086038HAC","Yen-AnMulin 10% W/W Powder","Yenher Agro-products Sdn. Bhd."
"1519","MAL23126017AZ","AZAPAN (Azacitidine Lyophilised Powder for suspension for Injection) 100mg/vial","BioCare Pharmaceutical (M) Sdn. Bhd."
"1520","MAL22096046HA","Farmaxilin 50% w/w Soluble Powder","F.E. VENTURE SDN. BHD."
"1521","MAL22066110TC","JDB Jia De Bao Herbal Powder","GOLDEN CAT ENTERPRISE"
"1522","MAL22096050HA","AMPROFEED 250G/KG POWDER","RANGE PHARMA SDN. BHD."
"1523","MAL22106061NC","4Life Aloe Vera Plus Powder","Forlife Research Imports Sdn. Bhd."
"1524","MAL22116118TC","Shou Hsing Brand Bao Ying Dan Powder","CHUA TONGSAN SDN. BHD."
"1525","MAL22046047NC","GKB ProbiZymes + Powder","GK BIO INTERNATIONAL SDN. BHD."
"1526","MAL23116010AZ","Lastinem-500 (Imipenem and Cilastatin Powder for Solution for Infusion 500 mg/ 500mg)","UNIMED SDN. BHD."
"1527","MAL22036042N","Dale & Cecil MIWACARE VIT C+ powder","OMEGA HEALTH PRODUCTS SDN BHD"
"1528","MAL23086028AZ","NABOTA Powder 100 Units for Solution for Injection","ARDENCE PHARMA SDN BHD"
"1529","MAL22076054NC","BIOGAIA PROTECTIS POWDER","Pharma Ace Sdn. Bhd."
"1530","MAL22066066TC","MRZ NORISHING POWDER","MRZ HERBAL HEALTHY CARE"
"1531","MAL22086039NC","Recogen Collagen Peptides 10g Powder","Roots Basic Sdn. Bhd."
"1532","MAL22126067HA","QKP Maduramicin Premix 1% W/W Powder","Panfast Marketing (m) Sdn Bhd"
"1533","MAL22076123TC","Wang's Herbaceous Plants Anbao Extract Powder","Shenlu Biotech Sdn Bhd"
"1534","MAL23026025HA","TP-LINSPEC 222/445 MG/G WATER SOLUBLE POWDER","Thye Pharma Sdn. Bhd"
"1535","MAL22086043NC","Recogen Calcium Collagen Powder","Roots Basic Sdn. Bhd."
"1536","MAL22076001ACRZ","Veklury lyophilized powder for injection (remdesivir 100 mg/vial)","Gilead Sciences Malaysia Sdn. Bhd."
"1537","MAL23126019AZ","BLEOSOL (BLEOMYCIN POWDER FOR SOLUTION FOR INJECTION / INFUSION 15 UNITS)","UNIMED SDN. BHD."
"1538","MAL22116093TC","Nature's Gift HERBAL MATRIX POWDER","LINTAN ENTERPRISE SDN.BHD"
"1539","MAL22086064NC","JOURDENESS PROBIOTIC LACTOBACILLUS PARACASEI NTU101 PLUS POWDER","BIO-JOURDENESS COSMETIC CO. (MY) SDN BHD"
"1540","MAL22066083NC","ALTERFLOR BB PROBIOTIC WITH FOS POWDER","BIO INTEGRUM SDN BHD"
"1541","MAL24046016AZ","VANCO-500 (Vancomycin Hydrochloride USP Powder for solution for infusion 500 mg)","HEALOL PHARMACEUTICALS SDN. BHD."
"1542","MAL24056071AZ","SANFUR - DS 125 (CEFUROXIME AXETIL POWDER FOR ORAL SUSPENSION USP 125mg/5ml)","PERNIAGAAN NORMAHAS SDN. BHD."
"1543","MAL23076004ACRZ","Enerzair Breezhaler (Indacaterol Acetate/Glycopyrronium Bromide/Mometasone Furoate) 150/50/80mcg Inhalation Powder Hard Capsules","NOVARTIS CORPORATION (MALAYSIA) SDN. BHD."
"1544","MAL22076048HX","SOLITE, 1000mg/g, Powder for use in drinking water","N.S. LABORATORY SDN. BHD."
"1545","MAL22106076T","YL Rehmannia Complex Powder","YANLING NATURAL HYGIENE SDN. BHD."
"1546","MAL22116108T","YL Polygonum Complex Powder","YANLING NATURAL HYGIENE SDN. BHD."
"1547","MAL23116013AZ","Retorin Powder for Suspension 125mg / 5ml","SM PHARMACEUTICALS SDN. BHD."
"1548","MAL22106024XC","Nutravita Glucosamine 1500mg Powder","Eucogen Pharma Sdn. Bhd."
"1549","MAL23096007AZ","Glenmark Airz F (Glycopyrronium 12.5mcg and Formoterol Fumarate 12mcg) Powder for Inhalation","Glenmark Pharmaceuticals (Malaysia) Sdn. Bhd."
"1550","MAL22076049HX","HEXINE, 20mg/g, Powder for use in drinking water","N.S. LABORATORY SDN. BHD."
"1551","MAL22076067NC","General Balance Probiotics Powder","GCOOP MALAYSIA SDN. BHD."
"1552","MAL22096114TC","Kindness Qing Ke Powder","RUMAH TERAPI TRADISIONAL DONNA SDN BHD"
"1553","MAL22106052NC","Avance LB-30 powder","BEST WORLD LIFESTYLE SDN. BHD."
"1554","MAL24076015ACZ","Voriconazole-AFT 200 mg powder for solution for infusion","AFT PHARMACEUTICALS (SE ASIA) SDN BHD"
"1555","MAL23026026NZ","BIHAN Vitabglow powder","HA ONE HOLDINGS SDN BHD"
"1556","MAL22116082TC","LION BALL TUI RE MAO DAN POWDER","Gab Sdn Bhd"
"1557","MAL23066001ACRZ","TEPADINA 15 mg powder for concentrate for solution for infusion","DKSH MALAYSIA SDN. BHD."
"1558","MAL24076116AZ","CALINOR ORAL POWDER","Noripharma Sdn. Bhd."
"1559","MAL22086067NC","ARDENCE SERIES AFA Plus Powder","ARDENCE VENTURE SDN. BHD."
"1560","MAL24046020ACZ","INVOX Parecoxib 40 mg Powder for Solution for Injection and Sodium Chloride Injection 0.9 % w/v (Diluent)","HEALOL PHARMACEUTICALS SDN. BHD."
"1561","MAL22116056NC","ALTERFLOR ADULT PROBIOTIC WITH FOS POWDER","BIO INTEGRUM SDN BHD"
"1562","MAL22116057NC","ALTERFLOR KIDS PROBIOTIC WITH FOS POWDER","BIO INTEGRUM SDN BHD"
"1563","MAL22096069N","VITASEN C 1000 plus Zinc & Beta Carotene Effervescent Powder (Orange Flavour)","WINWA MEDICAL SDN. BHD."
"1564","MAL23096023AZ","Ticplat 200 (Teicoplanin 200mg powder for solution for injection or infusion)","MEDISPEC (M) SDN. BHD."
"1565","MAL22096072N","VITASEN Elderberry C 1000 & Zinc Effervescent Powder (Mixed Berry Flavour)","WINWA MEDICAL SDN. BHD."
"1566","MAL23066002ACRZ","TEPADINA 100 mg powder for concentrate for solution for infusion","DKSH MALAYSIA SDN. BHD."
"1567","MAL23066003AZ","TEPADINA 400 mg powder and solvent for solution for infusion","DKSH MALAYSIA SDN. BHD."
"1568","MAL23106016AZ","Sanzyme FSH 75 IU (Urofollitropin Lyophilised Powder for Solution for Injection BP, 75 IU/vial) & Sodium Chloride Injection USP 1ml Ampoule (Sterile 0.9% w/v solution of Sodium Chloride)","Haczen Sdn Bhd"
"1569","MAL23106017AZ","Sanzyme FSH 150 IU (Urofollitropin Lyophilised Powder for Solution for Injection BP, 150 IU/vial) & Sodium Chloride Injection USP 1ml Ampoule (Sterile 0.9% w/v solution of Sodium Chloride)","Haczen Sdn Bhd"
"1570","MAL23016140TC","EU YAN SANG ZHUPAK PAK POH POWDER","EU YAN SANG (1959) SDN.BHD."
"1571","MAL22126166TC","DIANZ D'KAIREN CLEANSE POWDER","Dian Legacy Sdn Bhd"
"1572","MAL23036076NC","SEOBIO SUPRE PROBIOTICS POWDER","DERMASUNG SDN BHD"
"1573","MAL25046007ACRZ","Alveofact 45 mg/ml, 108 mg PHOSPHOLIPID FRACTION FROM BOVINE LUNG (SURFACTANT) POWDER AND SOLVENT FOR PREPARATION OF SUSPENSION INTRATRACHEAL","IDAMAN PHARMA SDN. BHD."
"1574","MAL23036146T","""Sun Ten"" Gou Qi Zi 0.43g/1.00g Extract Powders","SUN TEN PHARMACEUTICAL MFG (M) SDN. BHD."
"1575","MAL25046006ACRZ","Alveofact 45 mg/ml, 54 mg PHOSPHOLIPID FRACTION FROM BOVINE LUNG (SURFACTANT) POWDER AND SOLVENT FOR PREPARATION OF SUSPENSION INTRATRACHEAL","IDAMAN PHARMA SDN. BHD."
"1576","MAL24016016AZ","AZACT SPAL-P 100 (Azacitidine powder for suspension for injection, 100 mg/vial)","HEALOL PHARMACEUTICALS SDN. BHD."
"1577","MAL23046181TC","Ginbio Ginseng 1g/1g Powder","GINBIO ENTERPRISE"
"1578","MAL22126143N","PosBion-P Powder","MY MYRACLE SDN. BHD."
"1579","MAL23016123T","Alpha Fiber D Powder","ALPHA ACTIVE INDUSTRIES SDN BHD"
"1580","MAL22096067N","VITASEN Buffer C with Acerola & Bioflavonoid Effervescent Powder (Citrus Flavour)","WINWA MEDICAL SDN. BHD."
"1581","MAL23086017AZ","Dycox 40mg Powder for Solution for Injection","NOVUGEN PHARMA SDN. BHD."
"1582","MAL22126077N","YL UCran-C Powder","YANLING NATURAL HYGIENE SDN. BHD."
"1583","MAL25046020AZ","BEMUNAT 25 (Bendamustine Hydrochloride 25 mg Powder for Concentrate for Solution for Infusion)","PERNIAGAAN NORMAHAS SDN. BHD."
"1584","MAL22116066TC","CK BALANCE GINSENG 1000mg POWDER","GCOOP MALAYSIA SDN. BHD."
"1585","MAL23036113T","Alpha Fiber Gold Powder","ALPHA ACTIVE INDUSTRIES SDN BHD"
"1586","MAL24036024ACZ","PipTaz-AFT, Piperacillin and Tazobactam Powder for Solution for Injection or Infusion 4.5g","AFT PHARMACEUTICALS (SE ASIA) SDN BHD"
"1587","MAL23106040HA","Amox Forte Water Soluble Powder 500mg/g","Sum Soon Agricultural Co. Sdn Bhd"
"1588","MAL23106002ARZ","Bortezomib Kabi Powder for Solution for Injection 3.5mg/vial","FRESENIUS KABI MALAYSIA SDN. BHD"
"1589","MAL23016089N","REOXlife iMgard Powder","BRAND8 NUTRACEUTICAL SDN. BHD."
"1590","MAL23016030HA","NS-CTC, 500mg/g, Powder for use in drinking water","N.S. LABORATORY SDN. BHD."
"1591","MAL24036023ACZ","Andason Lyophilized Powder for Suspension for Injection 100mg/vial","Nano Medic Care Sdn. Bhd."
"1592","MAL23096025AZ","Myelomib 3.5mg Lyophilized Powder for Solution for Injection","NOVUGEN ONCOLOGY SDN. BHD."
"1593","MAL25016014AZ","AZASQUARE (Azacitidine Powder for Suspension for Injection 25mg/mL (100 mg/vial))","SYNERRV SDN BHD"
"1594","MAL26016029AZ","HEMAZA (Azacitidine Powder for Suspension for Injection 100mg/vial)","CAMBER LABORATORIES SDN. BHD."
"1595","MAL22116061NC","ASH II PROGUD POWDER","NUTRISCIENCE GLOBAL SDN. BHD."
"1596","MAL23086006AZ","NEXVIAZYME 100mg Powder for Concentrate for Solution for Infusion","SANOFI-AVENTIS (MALAYSIA) SDN. BHD."
"1597","MAL23016091N","VITASEN Triple Action Vitamin C Zinc & D3 Effervescent Powder (Orange Flavour)","WINWA MEDICAL SDN. BHD."
"1598","MAL23046159T","Alpha S Powder","ALPHA ACTIVE INDUSTRIES SDN BHD"
"1599","MAL23036062NC","BiO-LiFE MEGA-C Plus Bioflavonoid powder","MEGA LIFESCIENCES SDN. BHD."
"1600","MAL24016009AZ","MITONCO 10mg powder for solution for injection/infusion or intravesical","FIRST PHARMACEUTICAL SDN. BHD."
"1601","MAL23016152TC","KHENG HENG WATERMELON FROST COMPOUND POWDER","KHENG HENG MEDICAL (M) SDN BHD"
"1602","MAL23046134TC","DS PHARMA TIGER MILK MUSHROOM PLUS POWDER","MRZ HERBAL HEALTHY CARE"
"1603","MAL24026007ASZ","Octaplex Powder and Solvent for Solution for Infusion","Pharmaniaga Marketing Sdn Bhd"
"1604","MAL23016064NC","RK Probiotics Plus Powder","Maximus Resources Sdn. Bhd."
"1605","MAL22126080NC","THROZZ KIDS MULTIVITAMIN Effervescent Powder (BLACKCURRANT ORANGE FLAVOUR)","MEDICINSPIRE GLOBAL SDN BHD"
"1606","MAL23076020XC","Janipro Gutril-S Powder","Janipro (M) Sdn Bhd"
"1607","MAL24046056HAC","COSULTRIM PLUS 75% W/W WATER SOLUBLE POWDER","Fijiliam Enterprise Sdn. Bhd."
"1608","MAL23046103N","NUREOX Enzyme Plus Powder","BRAND8 NUTRACEUTICAL SDN. BHD."
"1609","MAL25026015AZ","Vaxcel Polymyxin E 1M IU Powder for Injection, Infusion or Inhalation","KOTRA PHARMA (M) SDN. BHD."
"1610","MAL23076114TC","SWS Herbal Mix Rice Paper Pith Plus Powder","SWS 28 MEDICAL SDN BHD"
"1611","MAL23076125TC","SWS Tiao Bu Yang Sheng Powder","SWS 28 MEDICAL SDN BHD"
"1612","MAL24086017AZ","BortiRel (Bortezomib 1 mg powder for solution for injection)","Mansa Healthcare Sdn Bhd"
"1613","MAL23026037N","VITASEN Elderberry Plus Vitamin C & Zinc Effervescent Powder (Mixed Berry Flavour)","WINWA MEDICAL SDN. BHD."
"1614","MAL24086018AZ","BortiRel (Bortezomib 3.5 mg powder for solution for injection)","Mansa Healthcare Sdn Bhd"
"1615","MAL24046057HAC","NEO-VET -(Neomycin 20% w/w   Water Soluble  Powder)","Fijiliam Enterprise Sdn. Bhd."
